<?xml version="1.0" encoding="UTF-8"?>
<xs:schema xmlns:xs="http://www.w3.org/2001/XMLSchema">
  <xs:element name="agenda">
    <xs:complexType>
      <xs:sequence>
        <xs:element name="contacto" maxOccurs="unbounded">
          <xs:complexType>
            <xs:sequence>
              <xs:element name="nombre" type="xs:string"/>
              <xs:element name="email" type="xs:string"/>
              <xs:element name="sexo">
                <xs:simpleType>
                    <xs:restriction base="xs:string">
                        <xs:enumeration value="mujer"/>
                        <xs:enumeration value="hombre"/>
                    </xs:restriction>
                </xs:simpleType>
              </xs:element>
              <xs:element name="codigo_postal">
                <xs:simpleType>
                    <xs:restriction base="xs:string">
                        <xs:length value="5"></xs:length>
                    </xs:restriction>
                </xs:simpleType>
              </xs:element>
             </xs:sequence>
          </xs:complexType>
        </xs:element>
      </xs:sequence>
    </xs:complexType>
  </xs:element>
</xs:schema>